id	Janela	Sentence	tamanho da janela	Palavra alvo	Classe
608	, fazem do escravo o tipo da	Ninguém dissimula melhor do que o escravo : sua condição sempre passiva , a obrigação da obediência sem limite e sem reflexão , o temor do castigo , a necessidade de esconder o ressentimento para não excitar a cólera ameaçadora do senhor , o hábito da mentira , enfim , fazem do escravo o tipo da dissimulação .	7	escravo	escravo
609	O coração do escravo é escuro ,	O coração do escravo é escuro , tenebroso como noite de tempestade : é abismo profundo e sem luz coberto pela crosta da tristeza íntima e da desconfiança perpétua .	7	escravo	escravo
610	Muitas vezes o escravo ri , tendo	Muitas vezes o escravo ri , tendo o seio ulcerado e a alma em pranto .	7	escravo	escravo
619	de amizade de negro – observou o	– Não faço conta de amizade de negro – observou o Barbudo .	7	negro	negro
636	senhoras , um escravo desmoralizado , e	– Ele é , com perdão senhoras , um escravo desmoralizado , e talvez seja por exceção ou milagre um liberto de bons costumes .	7	escravo	escravo
649	estaria pensando esse escravo que ia ser	Enquanto elas estavam assim ocupando-se tão generosamente de Simeão , em que estaria pensando esse escravo que ia ser emancipado ?	7	escravo	escravo
650	com alma de escravo que não sonhava	Estava ainda pensando com alma de escravo que não sonhava com a liberdade no dia seguinte .	7	escravo	escravo
653	Simeão , o escravo , nem se	Mas Simeão , o escravo , nem se lembrava do aniversário natalício , que só é de festa para o homem livre , que sorri à vida , porque é livre ; não podia esperar e menos contar com a liberdade esclarecida pelo sol que ia surgir do oriente .	7	escravo	escravo
656	quem tenha um escravo ao pé de	Não há quem tenha um escravo ao pé de si , que não tenha ao pé de si um natural inimigo .	7	escravo	escravo
689	: o outro negro recebeu a lanterna	Chegados à sala de jantar o crioulo mostrou ao lado direito a porta do aposento de Hermano e de Florinda ; dois dos perversos , o Barbudo e um dos negros colocaram-se aos lados dessa porta : o outro negro recebeu a lanterna e seguiu a Simeão que avançou para a frente e entrou no quarto de dormir de sua senhora .	7	negro	negro
702	e o outro negro que levava a	Simeão , esquecendo o golpe que recebera , e o sangue que do ombro lhe corria , deixou um dos negros na sala onde estavam os dois cadáveres e com o Barbudo e o outro negro que levava a lanterna , voltou ao quarto da senhora assassinada , arrombou facilmente a gaveta da velha mesa , e apoderando-se de uma grossa chave , foi ao fundo do quarto , arrancou precipitado uma cortina de chita que cobria pequena parte da parede e mostrando em grande vão que havia nesta uma caixa de jacarandá chapeada de ferro , abriu rápido duas fechaduras , e escancarou a caixa que estava cheia de pequenos sacos contendo moedas de ouro e prata .	7	negro	negro
703	correu o outro escravo que ficara na	Os três ladrões lançaram-se ao tesouro : ao ruído da colheita dos despojos correu o outro escravo que ficara na sala ; imediatamente porém rompeu a vozeria e o estrépito do combate ao pé da casa .	7	escravo	escravo
711	exceção matou o escravo e deixou com	A lei de exceção matou o escravo e deixou com vida o Barbudo tão celerado como ele , ou , se é possível , mais celerado que ele .	7	escravo	escravo
714	mortífera contra o escravo ; porque e	É imoral a exceção da lei na regra mortífera contra o escravo ; porque e uma iniqüidade de mais imposta embora pela necessidade de aterrar os escravos , necessidade que manifesta as aberrações de todas as noções do direito e da justiça , a que a existência da escravidão obriga a sociedade , a quem castiga , e de quem se vinga , corrompendo-a .	7	escravo	escravo
718	se não fosse escravo , poderia não	Pois eu vos digo que Simeão , se não fosse escravo , poderia não ter sido nem ingrato , nem perverso .	7	escravo	escravo
742	Ainda nisto o escravo africano , sem	Ainda nisto o escravo africano , sem o pensar , vinga-se da violência tremenda da escravidão .	7	escravo	escravo
745	e pagou o escravo , pôde pela	Nessa importação inqualificável e forçada do homem , a prepotência do importador que vendeu e do comprador que tomou e pagou o escravo , pôde pela força que não é direito , reduzir o homem a coisa , a objeto material de propriedade , a instrumento de trabalho ; mas não pôde separar do homem importado os costumes , as crenças absurdas , as idéias falsas de uma religião extravagante , rudemente supersticiosa , e eivada de ridículos e estúpidos prejuízos .	7	escravo	escravo
746	a alma do escravo : comprara-lhe os	Nunca houve comprador de africano importado , que pensasse um momento sobre a alma do escravo : comprara-lhe os braços , o corpo para o trabalho ; esquecera-lhe a alma ; também se a tivesse conscienciosamente lembrado , não compraria o homem , seu irmão diante de Deus .	7	escravo	escravo
747	africano vendido , escravo pelo corpo ,	Mas o africano vendido , escravo pelo corpo , livre sempre pela alma , de que não se cuidou , que não se esclareceu , em que não se fez acender a luz da religião única verdadeira , conservou puros e ilesos os costumes , seus erros , seus prejuízos selvagens , e inoculou-os todos na terra da proscrição e do cativeiro .	7	escravo	escravo
753	E assim o negro d’África , reduzido	E assim o negro d’África , reduzido à ignomínia da escravidão , malfez logo e naturalmente a sociedade opressora , viciando-a , aviltando-a pondo-a também um pouco asselvajada , como ele .	7	negro	negro
755	tratamento fraternal ao escravo ; mas adotou	No Brasil a gente livre mais rude nega , como o faz a civilizada , a mão e o tratamento fraternal ao escravo ; mas adotou e conserva as fantasias pavorosas , as superstições dos míseros africanos , entre os quais avulta por mais perigosa e nociva a crença do feitiço .	7	escravo	escravo
758	é um africano escravo , ou algum	O pagode é de ordinário uma casa solitária ; o sacerdote é um africano escravo , ou algum digno descendente e discípulo seu , embora livre ou liberto , e nunca falta a sacerdotisa da sua igualha ; o culto é de noite à luz das candeias ou do braseiro ; as cerimônias e os mistérios de incalculável variedade , conforme a imaginação mais ou menos assanhada dos embusteiros .	7	escravo	escravo
760	Brasil e do negro d’África ; vêem-se	Soam os grosseiros instrumentos que lembram as festas selvagens do índio do Brasil e do negro d’África ; vêem-se talismãs rústicos , símbolos ridículos ; ornamentam-se o sacerdote e a sacerdotisa com penachos e adornos emblemáticos e de vivas cores ; prepara-se ao fogo , ou na velha imunda mesa , beberagem desconhecida , infusão de raízes enjoativas e quase sempre ou algumas vezes esquálida ; o sacerdote rompe em dança frenética , terrível , convulsiva , e muitas vezes , como a sibila , se estorce no chão : a sacerdotisa anda como doida , entra e sai , e volta para tornar a sair , lança ao fogo folhas e raízes que enchem de fumo sufocante e de cheiro ativo e desagradável a infecta sala , e no fim de uma hora de contorsões e de dança de demônio , de ansiedade e de corrida louca da sócia do embusteiro , ela volta enfim do quintal , onde nada viu , e anuncia a chegada do gênio , do espírito , do deus do feitiço , para o qual há vinte nomes cada qual mais burlesco e mais brutal .	7	negro	negro
767	cativos de um escravo , deixando-se dominar	Desse culto grotesco , esquálido da feitiçaria sai o gérmen da desmoralização de muitas famílias , cujos chefes por superstição e fraqueza são cativos de um escravo , deixando-se dominar pelo grande feiticeiro .	7	escravo	escravo
776	concede , o negro escravo acredita no	Em regra que poucas exceções concede , o negro escravo acredita no poder do feiticeiro , como o velho muçulmano no alcorão de Maomé .	7	negro	negro
776	, o negro escravo acredita no poder	Em regra que poucas exceções concede , o negro escravo acredita no poder do feiticeiro , como o velho muçulmano no alcorão de Maomé .	7	escravo	escravo
779	na realidade o negro escravo feiticeiro ?	Mas que é na realidade o negro escravo feiticeiro ?	7	negro	negro
782	existe , o negro herbolário , o	O feiticeiro das fazendas e dos estabelecimentos rurais , ainda mesmo dos mais modestos , é , se infelizmente entre os escravos existe , o negro herbolário , o botânico prático que conhece as propriedades e a ação terrível de raízes , folhas e frutas que debilitam , enlouquecem , e fazem morrer o homem ; que abatem com as forças físicas a força moral do homem , e ao que eles chamam – amansar o senhor ; que excitam a luxúria , e os instintos animais ; que atacam o cérebro e corrompem a razão ; que envenenam pouco a pouco dilacerando o estômago e os intestinos até matar no fim de horríveis tormentos , ou que de repente , em poucas horas , em breves minutos assassinam , como o tiro do bacamarte , mas sem o ruído do tiro do bacamarte .	7	negro	negro
783	essa ciência ao negro analfabeto e ignorante	Quem deu essa ciência ao negro analfabeto e ignorante ? ...	7	negro	negro
784	d’África , o negro atiçou a inteligência	a rude experiência própria ou a revelação fraternal que o prepararam na África e que mais o armam , escravo na colônia escravagista : iniciado nos venenos vegetais d’África , o negro atiçou a inteligência para fazer o mal , vendo-se escravo ; recolheu e guardou a rude ciência dos olhos que distinguem as plantas ; onde foi , procurou , experimentou , achou vegetais venéficos ; conheceu uns pela experiência de outros escravos , foi ensaiando muitos nos animais domésticos , no gado da fazenda ; no aspecto , no sabor , no cheiro adivinhou às vezes o veneno nas flores , nos frutos , nas raízes do cipó , do arbusto , da árvore ; preparou assim sua ciência prática , misturou-a com sacrilegas rezas , com imprecações e votos desprezíveis e com uma química extravagante , imunda , nojenta que compõe cozimentos e infusões em que dez ou mais substâncias inertes ou apenas asquerosas se ajuntam com uma que é o veneno que opera .	7	negro	negro
784	o armam , escravo na colônia escravagista	a rude experiência própria ou a revelação fraternal que o prepararam na África e que mais o armam , escravo na colônia escravagista : iniciado nos venenos vegetais d’África , o negro atiçou a inteligência para fazer o mal , vendo-se escravo ; recolheu e guardou a rude ciência dos olhos que distinguem as plantas ; onde foi , procurou , experimentou , achou vegetais venéficos ; conheceu uns pela experiência de outros escravos , foi ensaiando muitos nos animais domésticos , no gado da fazenda ; no aspecto , no sabor , no cheiro adivinhou às vezes o veneno nas flores , nos frutos , nas raízes do cipó , do arbusto , da árvore ; preparou assim sua ciência prática , misturou-a com sacrilegas rezas , com imprecações e votos desprezíveis e com uma química extravagante , imunda , nojenta que compõe cozimentos e infusões em que dez ou mais substâncias inertes ou apenas asquerosas se ajuntam com uma que é o veneno que opera .	7	escravo	escravo
784	mal , vendo-se escravo ; recolheu e	a rude experiência própria ou a revelação fraternal que o prepararam na África e que mais o armam , escravo na colônia escravagista : iniciado nos venenos vegetais d’África , o negro atiçou a inteligência para fazer o mal , vendo-se escravo ; recolheu e guardou a rude ciência dos olhos que distinguem as plantas ; onde foi , procurou , experimentou , achou vegetais venéficos ; conheceu uns pela experiência de outros escravos , foi ensaiando muitos nos animais domésticos , no gado da fazenda ; no aspecto , no sabor , no cheiro adivinhou às vezes o veneno nas flores , nos frutos , nas raízes do cipó , do arbusto , da árvore ; preparou assim sua ciência prática , misturou-a com sacrilegas rezas , com imprecações e votos desprezíveis e com uma química extravagante , imunda , nojenta que compõe cozimentos e infusões em que dez ou mais substâncias inertes ou apenas asquerosas se ajuntam com uma que é o veneno que opera .	7	escravo	escravo
790	encontrareis nele um negro escravo ... ou	E sempre que puserdes a mão em um desses feiticeiros , encontrareis nele um negro escravo ... ou algum seu iniciado .	7	negro	negro
790	nele um negro escravo ... ou algum	E sempre que puserdes a mão em um desses feiticeiros , encontrareis nele um negro escravo ... ou algum seu iniciado .	7	escravo	escravo
791	precauções : o escravo , não nos	E tomai sentido e precauções : o escravo , não nos cansaremos de o repetir , é antes de tudo natural inimigo de seu senhor ; e o escravo que é feiticeiro , sabe matar .	7	escravo	escravo
791	; e o escravo que é feiticeiro	E tomai sentido e precauções : o escravo , não nos cansaremos de o repetir , é antes de tudo natural inimigo de seu senhor ; e o escravo que é feiticeiro , sabe matar .	7	escravo	escravo
799	um ou outro escravo : não comprava	Paulo Borges , pois , era dominado por esse fraco da sua natureza de lavrador mais que abastado : onde havia terras a vender junto ou perto das suas , ele as tomava , ainda por elevado preço , imobilizando assim avultadas somas ; se notícias lhe chegavam de arrematação de escravos na vila , ou de venda de alguns nas proximidades da sua fazenda , arrancava-se aos encantos da roça , e lá ia realizar a compra : jamais se ocupara de tomar informações sobre a moralidade , ou antes sobre os graus de desmoralização da gente que introduzia na sua fazenda , nem lhe importava a celebridade ruim de um ou outro escravo : não comprava homens , comprava máquinas ; queria braços e não corações ; além disso tendo fama , e gabando-se de senhor severo e forte , entrava nos seus timbres amansar os negros altanados e incorrigíveis .	7	escravo	escravo
801	ordens a um escravo que na sua	Cinco anos depois do seu casamento , Paulo Borges deixou de ir à roça uma manhã ; deu suas ordens a um escravo que na sua falta servia de feitor , vestiu-se com algum esmero , e , almoço acabado , tomou o chapéu para sair .	7	escravo	escravo
806	Pai-Raiol , um negro feio e já	Entre eles vinha Pai-Raiol , um negro feio e já desfigurado por moléstia ou por castigos .	7	negro	negro
810	muito raro desse negro era hediondo por	Era um negro africano de trinta a trinta e seis anos de idade , um dos últimos importados da África pelo tráfico nefando : homem de baixa estatura , tinha o corpo exageradamente maior que as pernas ; a cabeça grande , os olhos vesgos , mas brilhantes e impossíveis de se resistir à fixidade do seu olhar pela impressão incômoda do estrabismo duplo , e por não sabermos que fluição de magnetismo infernal ; quanto ao mais , mostrava os caracteres físicos da sua raça ; trazia porém nas faces cicatrizes vultuosas de sarjaduras recebidas na infância : um golpe de azorrague lhe partira pelo meio o lábio superior , e a fenda resultante deixara a descoberto dois dentes brancos , alvejantes , pontudos , dentes caninos que pareciam ostentar-se ameaçadores ; sua boca era pois como mal fechada por três lábios ; dois superiores e completamente separados , e um inferior perfeito : o rir aliás muito raro desse negro era hediondo por semelhante deformidade ; a barda retorcida e pobre que ele tinha mal crescida no queixo , como erva mesquinha em solo árido , em vez de ornar afeiava-lhe o semblante ; uma de suas orelhas perdera o terço da concha na parte superior cortada irregularmente em violência de castigo ou em furor de desordem ; e finalmente braços longos prendendo-se a mãos descomunais que desciam à altura dos joelhos completavam-lhe o aspecto repugnante da figura mais antipática .	7	negro	negro
812	disso , o negro se fizera temível	Além disso , o negro se fizera temível pela audácia de seu ânimo , e força física ainda mais avultada pela agilidade e presteza de movimentos nas lutas .	7	negro	negro
818	consoladora sociedade do negro e da negra	Paulo Borges não dava importância a essas ligações de escravo e escrava ; mas , pois que a do Pai-Raiol e de Esméria lhe aproveitava , reputou afortunada a compra que mantinha a consoladora sociedade do negro e da negra que se diziam amar .	7	negro	negro
818	essas ligações de escravo e escrava ;	Paulo Borges não dava importância a essas ligações de escravo e escrava ; mas , pois que a do Pai-Raiol e de Esméria lhe aproveitava , reputou afortunada a compra que mantinha a consoladora sociedade do negro e da negra que se diziam amar .	7	escravo	escravo
821	experimentara vendo o negro ; sentiu que	Teresa lembrou-se da impressão repulsiva que experimentara vendo o negro ; sentiu que a sua antipatia achasse explicáveis fundamentos , e gostando que uma escrava tivesse podido domar o escravo enfezado e indisciplinável , pois que por fim de contas era sempre a mulher dominando o homem da sua igualha ou condição , teve curiosidade de ver Esméria , e no dia seguinte , quando ao anoitecer chegaram os escravos da roça , mandou-a chamar .	7	negro	negro
821	podido domar o escravo enfezado e indisciplinável	Teresa lembrou-se da impressão repulsiva que experimentara vendo o negro ; sentiu que a sua antipatia achasse explicáveis fundamentos , e gostando que uma escrava tivesse podido domar o escravo enfezado e indisciplinável , pois que por fim de contas era sempre a mulher dominando o homem da sua igualha ou condição , teve curiosidade de ver Esméria , e no dia seguinte , quando ao anoitecer chegaram os escravos da roça , mandou-a chamar .	7	escravo	escravo
863	instintos animais do escravo , únicos que	Não bebia , e detestava o fumo : escrava , desconhecia as duas repugnantes consolações da escravidão , a dupla embriaguez da aguardente e do cachimbo ; mas em compensação era possessa do demônio da luxúria , que é o demônio torpe que desenfreia os instintos animais do escravo , únicos que o mantêm animal a despeito da prepotência que teima em reduzi-lo a simples coisa material .	7	escravo	escravo
869	que o refalsado negro africano nunca seria	Não era Esméria que dominava o Pai-Raiol pelo encanto do amor , a que o refalsado negro africano nunca seria suscetível de dobrar-se ; era a possessão como magnética da crioula pelo Pai-Raiol que sujeitava ela a ele .	7	negro	negro
875	sujeita ao feio negro para melhor senhoreá-lo	Os escravos teimavam em dizer que os dois eram amantes , e que a crioula , embora muito infiel , se fingia dócil e sujeita ao feio negro para melhor senhoreá-lo .	7	negro	negro
877	ameaçadoras ; o negro fixou os olhos	Uma vez , Raiol conduziu Esméria ao bosque e parando em um lugar onde mais se cerrava o cipoal assobiou por vezes , imitando os silvos das serpentes ; em breve acudiram uma depois de outra três cobras ameaçadoras ; o negro fixou os olhos sobre elas , segurou junto da cabeça em uma que se enrolou em seu braço , depois deixou-a livre e assim enrolada , ameigou- a , tirou-a do braço , guardou-a no seio e por fim soltou-a no chão ; e enquanto a crioula recuava tremendo de medo , repetiu o mesmo brinco , ou a mesma operação com outra cobra .	7	negro	negro
879	– disse o negro com ostentação .	– Pai-Raiol pode – disse o negro com ostentação .	7	negro	negro
887	que o tornara escravo , provocava a	Paulo Borges admirava-lhe em silêncio o amor do trabalho ; mas Raiol não trabalhava com amor , trabalhava com raiva : dir-se-ia que intimamente revoltado contra a violência que o tornara escravo , provocava a fadiga , atormentava-se nos deveres obrigados da escravidão para mais atiçar as fúrias que esta acendera em seu seio .	7	escravo	escravo
899	Sobre o misantropo negro pesava a fama	Sobre o misantropo negro pesava a fama antiga de feiticeiro ; mas nas vizinhanças da fazenda de Paulo Borges havia uma casa de candombes ou de cultos de feitiçaria e o Pai-Raiol nunca se lembrara de visitá-la .	7	negro	negro
901	a voz do escravo feitor que procurava	O Pai-Raiol nem por esse encanto se deixara jamais vencer , ou seduzir : a voz do escravo feitor que procurava informar-se das ausências severamente proibidas , era sempre respondida pelo escravo da senzala isolada .	7	escravo	escravo
901	sempre respondida pelo escravo da senzala isolada	O Pai-Raiol nem por esse encanto se deixara jamais vencer , ou seduzir : a voz do escravo feitor que procurava informar-se das ausências severamente proibidas , era sempre respondida pelo escravo da senzala isolada .	7	escravo	escravo
902	comprometiam o seu escravo mais diligente e	Paulo Borges que zombava da crença do feitiço e que não esquecia o vigor fervente da sua melhor enxada , desprezava as suspeitas de feitiçaria que desabonavam e comprometiam o seu escravo mais diligente e mais sossegado .	7	escravo	escravo
907	A senzala do escravo ameaçava , como	O natural inimigo do senhor velava ... A senzala do escravo ameaçava , como sempre , a casa do senhor .	7	escravo	escravo
913	ao ódio do escravo ; o simples	Tudo serve ao ódio do escravo ; o simples e incalculado movimento de antipatia de uma senhora suscetível , e até inocente repugnância , ou o medo infantil de uma criança .	7	escravo	escravo
914	era um monstro negro e imaginário ,	Luís , o filho mais velho de Paulo Borges e Teresa , menino de quatro anos , tinha um dia visto chegar da roça o Pai-Raiol e desatara a chorar assustado ; sua mãe correra a tomá-lo nos braços , e , perguntando-lhe porque chorava , o pobre anjinho apontara para o feio escravo , e dissera a soluçar : – É o zumbi ... o zumbi ... O zumbi era um monstro negro e imaginário , herói sinistro de estúpidas e horríveis histórias , com que as escravas , em vez de entreter , assombravam o nervoso menino com a mais lamentável e perigosa inconveniência , o que aliás é infelizmente muito comum em nossas famílias .	7	negro	negro
914	para o feio escravo , e dissera	Luís , o filho mais velho de Paulo Borges e Teresa , menino de quatro anos , tinha um dia visto chegar da roça o Pai-Raiol e desatara a chorar assustado ; sua mãe correra a tomá-lo nos braços , e , perguntando-lhe porque chorava , o pobre anjinho apontara para o feio escravo , e dissera a soluçar : – É o zumbi ... o zumbi ... O zumbi era um monstro negro e imaginário , herói sinistro de estúpidas e horríveis histórias , com que as escravas , em vez de entreter , assombravam o nervoso menino com a mais lamentável e perigosa inconveniência , o que aliás é infelizmente muito comum em nossas famílias .	7	escravo	escravo
946	a voz do negro terrível , mas	Uma noite e já tarde , o Pai-Raiol foi bater de manso à porta da senzala de Esméria que , ou ainda não dormia , ou acordando fácil , estremeceu , reconhecendo a voz do negro terrível , mas apressou-se a recebê-lo .	7	negro	negro
952	, o rancoroso escravo apesar de trazido	Por negação , incapacidade ou enfim por amor de sua língua ou dialeto selvagem , mas pátrio , o rancoroso escravo apesar de trazido ao Brasil há cerca de vinte anos , exprimia-se mal e deformemente em português , introduzindo muitas vezes na sua agreste conversação juras e frases africanas .	7	escravo	escravo
962	As carícias do escravo são ultrajes escandalosos	As carícias do escravo são ultrajes escandalosos na vida civilizada .	7	escravo	escravo
964	– disse o negro , sossegado .	– Dantes era melhor – disse o negro , sossegado .	7	negro	negro
967	sabe ... O negro sacudiu com a	– Pai-Raiol , foi você que se aborreceu de mim ... bem sabe ... O negro sacudiu com a cabeça , e tornou com voz comprimida e alterada : – Pai-raiol teve raiva de Esméria que andava como garrafa de cachaça no fado ... teve raiva , e quis matá-la ... para não matá-la ... empurrou-a ... A crioula tremeu .	7	negro	negro
977	e bárbara do escravo africano boçal e	Tudo isso foi dito com a palavra estropiada e bárbara do escravo africano boçal e rancoroso .	7	escravo	escravo
989	misantropo e feio negro da senzala dantes	Esméria , temendo o amante ou dele satisfeita , tornou-se mais esquiva aos outros escravos que a espiaram e descobriram a sua convivência noturna com o silencioso , misantropo e feio negro da senzala dantes solitária .	7	negro	negro
991	desaparecera , o negro tornou-se mais exigente	Entretanto e por isso mesmo que o segredo desaparecera , o negro tornou-se mais exigente e aos domingos e dias santificados reclamava com renitência a companhia de Esméria , que raramente podia condescender nesse ponto , presa como se achava ao serviço interno da casa da família .	7	negro	negro
998	quer : o negro da roça é	– O cachorro é melhor ; passeia , quando quer : o negro da roça é pior do que o cachorro ; mas é melhor que Esméria , porque tem domingo .	7	negro	negro
1018	de dizer o negro , muito mais	Todavia Esméria estava convencida de que era , como acabava de dizer o negro , muito mais bonita e elegante do que sua senhora .	7	negro	negro
1044	; mas o negro fixou os olhos	A crioula não respondeu ; mas o negro fixou os olhos na ninhada de pintainhos , como se os quisesse absorver nas órbitas .	7	negro	negro
1046	contemplava ansiosa o negro que , imóvel	Esméria considerava , contemplava ansiosa o negro que , imóvel e de olhos fitos , mirava a ninhada infeliz .	7	negro	negro
1048	– disse o negro , voltando-se .	– Pai-Raiol , quando quer , mata com os olhos – disse o negro , voltando-se .	7	negro	negro
