id	Janela	Sentence	tamanho da janela	Palavra alvo	Classe
22	no patuá do escravo ; seria uma	Se não fosse , se não se chamasse venda , teria outro e mil nomes no patuá do escravo ; seria uma casa no deserto , um sítio nas brenhas ; estaria na gruta da floresta , em um antro tomado às feras , mas onde iria sempre o escravo , o quilombola , vender o furto , embriagar-se , ultrajar a honra do senhor e de sua família , a quem detesta , engolfar-se em vícios , ouvir conselhos envenenados , inflamar-se em ódio , e habituar-se à idéia do crime filho da vingança ; porque o escravo , por melhor que seja tratado , é , em regra geral , pelo fato de ser escravo , sempre e natural e logicamente o primeiro e mais rancoroso inimigo de seu senhor .	7	escravo	escravo
22	iria sempre o escravo , o quilombola	Se não fosse , se não se chamasse venda , teria outro e mil nomes no patuá do escravo ; seria uma casa no deserto , um sítio nas brenhas ; estaria na gruta da floresta , em um antro tomado às feras , mas onde iria sempre o escravo , o quilombola , vender o furto , embriagar-se , ultrajar a honra do senhor e de sua família , a quem detesta , engolfar-se em vícios , ouvir conselhos envenenados , inflamar-se em ódio , e habituar-se à idéia do crime filho da vingança ; porque o escravo , por melhor que seja tratado , é , em regra geral , pelo fato de ser escravo , sempre e natural e logicamente o primeiro e mais rancoroso inimigo de seu senhor .	7	escravo	escravo
22	; porque o escravo , por melhor	Se não fosse , se não se chamasse venda , teria outro e mil nomes no patuá do escravo ; seria uma casa no deserto , um sítio nas brenhas ; estaria na gruta da floresta , em um antro tomado às feras , mas onde iria sempre o escravo , o quilombola , vender o furto , embriagar-se , ultrajar a honra do senhor e de sua família , a quem detesta , engolfar-se em vícios , ouvir conselhos envenenados , inflamar-se em ódio , e habituar-se à idéia do crime filho da vingança ; porque o escravo , por melhor que seja tratado , é , em regra geral , pelo fato de ser escravo , sempre e natural e logicamente o primeiro e mais rancoroso inimigo de seu senhor .	7	escravo	escravo
22	fato de ser escravo , sempre e	Se não fosse , se não se chamasse venda , teria outro e mil nomes no patuá do escravo ; seria uma casa no deserto , um sítio nas brenhas ; estaria na gruta da floresta , em um antro tomado às feras , mas onde iria sempre o escravo , o quilombola , vender o furto , embriagar-se , ultrajar a honra do senhor e de sua família , a quem detesta , engolfar-se em vícios , ouvir conselhos envenenados , inflamar-se em ódio , e habituar-se à idéia do crime filho da vingança ; porque o escravo , por melhor que seja tratado , é , em regra geral , pelo fato de ser escravo , sempre e natural e logicamente o primeiro e mais rancoroso inimigo de seu senhor .	7	escravo	escravo
26	à vida do escravo ; sem ela	Não há ; porque a venda está intimamente presa , imprescindivelmente adunada à vida do escravo ; sem ela , os suicídios dos escravos espantariam pelas suas proporções .	7	escravo	escravo
28	o antro do escravo é , antes	Não há rei sem trono , não há família sem lar , nem aves sem ninho , nem fera sem antro ; o trono , o lar , o ninho , o antro do escravo é , antes da senzala , a venda .	7	escravo	escravo
39	a hora do negro concurso noturno .	Há poucos anos , em um dia calmoso do mês de fevereiro , viam-se às três horas da tarde nessa venda certas figuras , formando um quadro quase constantemente ali observado com insignificantes modificações até a hora do negro concurso noturno .	7	negro	negro
47	era um crioulo escravo ainda muito jovem	O cavaleiro era um crioulo escravo ainda muito jovem .	7	escravo	escravo
54	pés esparramados do negro trabalhador de enxada	Havia em seus modos a expansão que só parece própria do homem livre : ele não tinha nem as mãos calejadas , nem os pés esparramados do negro trabalhador de enxada : era um escravo de cabelos penteados , vestido com asseio e certa faceirice , calçado , falando com os vícios de linguagem triviais no campo , mas sem a bruteza comum na gente da sua condição ; até certo ponto , pois , aceito , apadrinhado , protegido e acariciado pela família livre , pelo amor dos senhores .	7	negro	negro
54	: era um escravo de cabelos penteados	Havia em seus modos a expansão que só parece própria do homem livre : ele não tinha nem as mãos calejadas , nem os pés esparramados do negro trabalhador de enxada : era um escravo de cabelos penteados , vestido com asseio e certa faceirice , calçado , falando com os vícios de linguagem triviais no campo , mas sem a bruteza comum na gente da sua condição ; até certo ponto , pois , aceito , apadrinhado , protegido e acariciado pela família livre , pelo amor dos senhores .	7	escravo	escravo
75	ele se reconhece escravo , coisa e	No amor dos senhores o crioulo estimado viu , sentiu , gozou os reflexos das flamas vivificantes , generosas , sagradas da liberdade : mas vem um dia em que ele se reconhece escravo , coisa e não homem , apesar da afeição , das condescendências , dos caridosos benefícios do senhor – amigo , da senhora – segunda mãe ; vem a primeira hora sinistra em que ele , que até então vivera em sonhos e ilusões , desperta com a certeza horrível de que é um condenado daquém-berço ; condenado sem crime ; tendo alma e considerado simples matéria ambulante ; coisa , animal , que se vende , como a casa , como o boi e como a besta ; finalmente miserável e perpétuo desterrado em deserto sem horizonte , tendo vida e não vivendo para si , desejando sem esperanças , não possuindo de seu nem o pleno direito dos três amores mais santos : o de filho , o de esposo , e o de pai ; máquina para cavar com a enxada , homem desnaturado , miséria respirante e movente que os próprios cães distinguem pela marca do desprezo social .	7	escravo	escravo
76	da terra , escravo se reconhece e	O crioulo escravo e estimado , por isso mesmo que tem mais aguçada a inteligência , e por isso mesmo que deram-lhe as mostras dos gozos e da superioridade , mas não lhe deram a condição e a educação próprias do homem livre , pesa melhor que os escravos brutais o preço e o encanto da verdadeira liberdade ; no meio dos benefícios compreende que lhe falta um que vale mais do que todos os outros somados e multiplicados ; feliz pelos favores que recebe , pelos dons da afeição de que é objeto , esbarra sempre diante da realidade da escravidão , que o abate , avilta e moralmente o aniquila : deseja e não tem , quer e não pode , sonha e não realiza o bem supremo da terra , escravo se reconhece e bebe o ódio , os maus costumes , o veneno , a perversidade da escravidão .	7	escravo	escravo
77	família , e escravo , portanto infeccionado	O crioulo escravo e estimado , em quem o amor e as condescendências do senhor animam e atiçam expansões naturais do amplo gozo da liberdade , mistura nos dias da reflexão mais sombria e triste a lembrança dos sabores do reflexo da liberdade com a ameaça e os negros horrores da escravidão ; habituado à impunidade garantida pela afeição , ousa muito e abusa ainda mais ; como predileto da família , e escravo , portanto infeccionado de todos os vícios e ferozes impulsos da madre-fera escravidão , insolente e malcriado , nem perfeitamente livre , nem absolutamente escravo , bom juiz odiento , pois que conhece as duas condições , e da melhor é bastardo , e da pior legítimo filho , o crioulo escravo e estimado de seu senhor , torna-se em breve tempo ingrato e muitas vezes leva a ingratidão a perversidade , porque é escravo .	7	escravo	escravo
77	, nem absolutamente escravo , bom juiz	O crioulo escravo e estimado , em quem o amor e as condescendências do senhor animam e atiçam expansões naturais do amplo gozo da liberdade , mistura nos dias da reflexão mais sombria e triste a lembrança dos sabores do reflexo da liberdade com a ameaça e os negros horrores da escravidão ; habituado à impunidade garantida pela afeição , ousa muito e abusa ainda mais ; como predileto da família , e escravo , portanto infeccionado de todos os vícios e ferozes impulsos da madre-fera escravidão , insolente e malcriado , nem perfeitamente livre , nem absolutamente escravo , bom juiz odiento , pois que conhece as duas condições , e da melhor é bastardo , e da pior legítimo filho , o crioulo escravo e estimado de seu senhor , torna-se em breve tempo ingrato e muitas vezes leva a ingratidão a perversidade , porque é escravo .	7	escravo	escravo
77	, o crioulo escravo e estimado de	O crioulo escravo e estimado , em quem o amor e as condescendências do senhor animam e atiçam expansões naturais do amplo gozo da liberdade , mistura nos dias da reflexão mais sombria e triste a lembrança dos sabores do reflexo da liberdade com a ameaça e os negros horrores da escravidão ; habituado à impunidade garantida pela afeição , ousa muito e abusa ainda mais ; como predileto da família , e escravo , portanto infeccionado de todos os vícios e ferozes impulsos da madre-fera escravidão , insolente e malcriado , nem perfeitamente livre , nem absolutamente escravo , bom juiz odiento , pois que conhece as duas condições , e da melhor é bastardo , e da pior legítimo filho , o crioulo escravo e estimado de seu senhor , torna-se em breve tempo ingrato e muitas vezes leva a ingratidão a perversidade , porque é escravo .	7	escravo	escravo
78	pela condição de escravo , que corrompe	Mas a sua ingratidão e a sua perversidade não se explicam pela natureza da raça , o que seria absurdo ; explicam-se pela condição de escravo , que corrompe e perverte o homem .	7	escravo	escravo
81	– Tu és escravo como eu .	Havia para ele na casa de seus amorosos senhores um céu e um inferno : na sala o néctar da predileção e da amizade , na cozinha o veneno da inveja e o golfão dos vícios : na cozinha a negra má e impiedosa castigou-lhe as travessuras e exigências incômodas e apadrinhadas pelos senhores , repetindo-lhe mil vezes : – Tu és escravo como eu .	7	escravo	escravo
86	, e conservando-o escravo , sem o	Domingos Caetano e Angélica não destinavam Simeão para trabalhador de enxada , e não o fizeram aprender ofício algum , nem lhe deram tarefa , e ocupação na fazenda : abandonando-o à quase completa ociosidade , tolerando seus abusos com fraqueza e cega condescendência , e , o que é pior , simulando às vezes exagerada severidade esquecida logo depois , ameaçando sem realizar jamais a ameaça do castigo , dando enfim ao crioulo facilidades para o passeio , não raramente dinheiro para suas despesas fúteis , amando-o como filho adotivo , e conservando-o escravo , sem o querer , sem o pensar , auxiliaram as depravações da cozinha que perverteram o vadio da fazenda .	7	escravo	escravo
88	palavras referentes ao escravo ainda pequeno foi	E a promessa contida nas palavras referentes ao escravo ainda pequeno foi por muitas bocas traduzida com acerto ao escravo mais tarde jovem , por turvo juízo que encerrava esperança dependente de morte .	7	escravo	escravo
88	com acerto ao escravo mais tarde jovem	E a promessa contida nas palavras referentes ao escravo ainda pequeno foi por muitas bocas traduzida com acerto ao escravo mais tarde jovem , por turvo juízo que encerrava esperança dependente de morte .	7	escravo	escravo
91	próprio , Simeão escravo era já ingrato	E , por aborrecimento da escravidão , pelo anelo da liberdade completa , pelo encanto de chegar a ser dono de si próprio , Simeão escravo era já ingrato ; porque não pensava mais que a morte de seu benfeitor fosse um sucesso lamentável .	7	escravo	escravo
98	na alma do escravo ; só faltava	A escravidão já tinha com o seu cortejo lógico e quase sempre infalível de todos os sentimentos ruins , de todas as paixões ignóbeis , estragado o crioulo que talvez houvesse nascido com felizes disposições naturais : o ódio aos senhores já estava incubado na alma do escravo ; só faltava para desenvolvê-lo o calor mais forte da ação do domínio absoluto que desumaniza o homem a ele sujeito .	7	escravo	escravo
108	passo para o escravo e disse-lhe :	A moça avançou um passo para o escravo e disse-lhe : – Entrega-me o que furtaste : eu não direi nada e te perdoarei ... tu és doido e queres ser desgraçado ... Em vez de obedecer sem insolência e de curvar-se agradecido diante do anjo do perdão , o crioulo recuou , dizendo em alta voz : – É mentira !	7	escravo	escravo
127	comporta , o escravo tem o rancor	Em falta de pundonor e de vergonha , que a escravidão não comporta , o escravo tem o rancor e o desejo da vingança .	7	escravo	escravo
128	do rancor do escravo : às vezes	Nas pontas do açoite está o emblema do rancor do escravo : às vezes há nas pontas do açoite marcas de sangue .	7	escravo	escravo
133	a vida de escravo sem sofrimentos de	Simeão odiava pois seus senhores , a quem devia os cuidados zelosos de sua infância , amizade e proteção , e cegas condescendências que tanto lhe haviam suavizado a vida de escravo sem sofrimentos de escravo .	7	escravo	escravo
148	É o santo negro que ajuda os	É o santo negro que ajuda os diabos negros !	7	negro	negro
199	e noites simples escravo , e ainda	Sem poder vencer-se , por momentos sensibilizava-se ao aspecto do corpo quase cadáver , e ao ruído abafado do soluçar da família ; mas , só por momentos homem , era horas , dias e noites simples escravo , e ainda ao aspecto do corpo quase cadáver do senhor , e ao ruído abafado do soluçar da família ocultava sob a exterioridade mentirosa de compunção e tristeza , o gelo , a indiferença ingrata e os instintos perversos escravidão .	7	escravo	escravo
200	podia merecer do escravo o olhar fixo	O aborrecimento que ele já votava ao senhor dormia resfriado pela morte , que presumia próxima ; a morte , porém , era condição do sono do aborrecimento , e o senhor moribundo somente podia merecer do escravo o olhar fixo de vigia , insensível ao doloroso transe , esperando com aborrecido cansaço a última cena de um caso fastidioso .	7	escravo	escravo
203	ele , o escravo , o animal	Viu sem se enternecer as lágrimas que Angélica chorara de joelhos , abraçando os pés de seu marido quase agonizante , e em um momento supremo , em que a todos se afigurou derradeiro transe de Domingos Caetano , e quando Florinda nesse desespero que olvida tudo , tudo e até o pudor de donzela , quando Florinda descabelada , delirante se lançava no leito de seu pai , e era dali arrancada por parentes , contra quem se debatia em desatino , ele , o escravo , o animal composto de gelo e ódio , ele teve olhos malvados , sacrílegos , infames que pastassem publicamente nos seios nus , nos seios virginais da donzela que se deixava em desconcerto de vestidos pelo mais sagrado desconcerto da razão .	7	escravo	escravo
269	católica , no escravo era obrigação material	Mas esse exercício da caridade que em um homem livre fora virtude católica , no escravo era obrigação material , e portanto não falava nem ao coração , nem a consciência .	7	escravo	escravo
276	obscenas imaginações de escravo desmoralizado e só	O crioulo malcriado e infrene pelos hábitos da impunidade não se atrevia , é certo , a sonhar desejo criminoso e horrível contra a pureza angélica da senhora-moça ; mas no desprendimento licencioso da língua envenenada , e nas obscenas imaginações de escravo desmoralizado e só idea-dor de gozos materiais , apreciava a seu modo , e supunha exaltar , quando aviltava , as graças e os modos , o olhar , e o riso , as formas e os movimentos do corpo da senhora-moça ; e no meio das risadas dos parceiros , fazia o elogio dos dotes físicos de Florinda , como se tratasse da escrava libidinosa e corrupta , com quem na noite antecedente dançara o fado que apenas precedera a lubricidade brutal .	7	escravo	escravo
298	de seduzir um escravo para torná-lo cúmplice	No empenho de seduzir um escravo para torná-lo cúmplice no mais atroz atentado , metade do trabalho do sedutor está previamente feito pelo fato da escravidão .	7	escravo	escravo
316	, como vives escravo : tu passas	Não serás capaz de viver liberto , como vives escravo : tu passas um vidão .	7	escravo	escravo
317	; mas sou escravo ; este nome	– Talvez ; mas sou escravo ; este nome quando soa , fura-me os ouvidos , como se fosse um estoque envenenado ... – Não me venhas com essa ; eu sei o que esperas : o velho é rico a abarrotar , e sabes e contas que te deixará com a liberdade dinheiro bastante para o princípio de algum negociozinho .	7	escravo	escravo
364	A alegria do escravo estava dependente da	A alegria do escravo estava dependente da morte do senhor .	7	escravo	escravo
390	o juízo do escravo é infamemente torpe	O escravo não crê na pureza da donzela , nem na fidelidade da esposa mais nobre ; admite somente que a falta de oportunidade ou de ocasião para ser má seja o que mantém a honra das famílias ; a observação é cruel e injustíssima : o juízo do escravo é infamemente torpe ; mas ele julga conforme as idéias e a vida da escravidão .	7	escravo	escravo
394	cães e um negro escravo da cozinha	Simeão comprara os cães e um negro escravo da cozinha , e entrava todas as noites na casa de João de Sales .	7	negro	negro
394	e um negro escravo da cozinha ,	Simeão comprara os cães e um negro escravo da cozinha , e entrava todas as noites na casa de João de Sales .	7	escravo	escravo
397	Simeão , o escravo , ali ia	Ainda bem que Simeão , o escravo , ali ia somente como animal que o instinto arrasta em procura da sua igual ; se fora ladrão ou assassino tinha tido abertas a janela da sala e a porta da cozinha .	7	escravo	escravo
539	, e um negro escravo da fazenda	A porta abriu-se , e um negro escravo da fazenda de Domingos Caetano , entrou precipitado , bradando : – Simeão !	7	negro	negro
539	e um negro escravo da fazenda de	A porta abriu-se , e um negro escravo da fazenda de Domingos Caetano , entrou precipitado , bradando : – Simeão !	7	escravo	escravo
579	murmurando automaticamente“escravo ... escravo ... ” Saiu	Turvo e como atoleimado , atravessou a cozinha , murmurando automaticamente“escravo ... escravo ... ” Saiu para o campo , e como se falasse às árvores , aos animais , ao espaço , repetia sempre : “ escravo ... escravo ... ” Não refletia , não podia refletir ; tinha a alma cheia de uma só idéia , que o afrontava , semelhante ao pesadelo do sono do criminoso ; respirava , sentia , ouvia , dizia só essa idéia : “ escravo ... escravo ... ” Instintivamente e sem consciência tomou a estrada que o levava de costume à venda : ia sem ver por onde ia , tropeçou em uma pedra , caiu e feriu-se na cabeça ; a dor chamou-o não à razão , mas ao refletido ressentimento do seu desencanto ; sentou-se e apoiou a fronte sobre os joelhos , e nem percebeu o sangue que lhe corria da cabeça ferida .	7	escravo	escravo
579	sempre : “ escravo ... escravo ...	Turvo e como atoleimado , atravessou a cozinha , murmurando automaticamente“escravo ... escravo ... ” Saiu para o campo , e como se falasse às árvores , aos animais , ao espaço , repetia sempre : “ escravo ... escravo ... ” Não refletia , não podia refletir ; tinha a alma cheia de uma só idéia , que o afrontava , semelhante ao pesadelo do sono do criminoso ; respirava , sentia , ouvia , dizia só essa idéia : “ escravo ... escravo ... ” Instintivamente e sem consciência tomou a estrada que o levava de costume à venda : ia sem ver por onde ia , tropeçou em uma pedra , caiu e feriu-se na cabeça ; a dor chamou-o não à razão , mas ao refletido ressentimento do seu desencanto ; sentou-se e apoiou a fronte sobre os joelhos , e nem percebeu o sangue que lhe corria da cabeça ferida .	7	escravo	escravo
579	“ escravo ... escravo ... ” Não	Turvo e como atoleimado , atravessou a cozinha , murmurando automaticamente“escravo ... escravo ... ” Saiu para o campo , e como se falasse às árvores , aos animais , ao espaço , repetia sempre : “ escravo ... escravo ... ” Não refletia , não podia refletir ; tinha a alma cheia de uma só idéia , que o afrontava , semelhante ao pesadelo do sono do criminoso ; respirava , sentia , ouvia , dizia só essa idéia : “ escravo ... escravo ... ” Instintivamente e sem consciência tomou a estrada que o levava de costume à venda : ia sem ver por onde ia , tropeçou em uma pedra , caiu e feriu-se na cabeça ; a dor chamou-o não à razão , mas ao refletido ressentimento do seu desencanto ; sentou-se e apoiou a fronte sobre os joelhos , e nem percebeu o sangue que lhe corria da cabeça ferida .	7	escravo	escravo
579	idéia : “ escravo ... escravo ...	Turvo e como atoleimado , atravessou a cozinha , murmurando automaticamente“escravo ... escravo ... ” Saiu para o campo , e como se falasse às árvores , aos animais , ao espaço , repetia sempre : “ escravo ... escravo ... ” Não refletia , não podia refletir ; tinha a alma cheia de uma só idéia , que o afrontava , semelhante ao pesadelo do sono do criminoso ; respirava , sentia , ouvia , dizia só essa idéia : “ escravo ... escravo ... ” Instintivamente e sem consciência tomou a estrada que o levava de costume à venda : ia sem ver por onde ia , tropeçou em uma pedra , caiu e feriu-se na cabeça ; a dor chamou-o não à razão , mas ao refletido ressentimento do seu desencanto ; sentou-se e apoiou a fronte sobre os joelhos , e nem percebeu o sangue que lhe corria da cabeça ferida .	7	escravo	escravo
579	“ escravo ... escravo ... ” Instintivamente	Turvo e como atoleimado , atravessou a cozinha , murmurando automaticamente“escravo ... escravo ... ” Saiu para o campo , e como se falasse às árvores , aos animais , ao espaço , repetia sempre : “ escravo ... escravo ... ” Não refletia , não podia refletir ; tinha a alma cheia de uma só idéia , que o afrontava , semelhante ao pesadelo do sono do criminoso ; respirava , sentia , ouvia , dizia só essa idéia : “ escravo ... escravo ... ” Instintivamente e sem consciência tomou a estrada que o levava de costume à venda : ia sem ver por onde ia , tropeçou em uma pedra , caiu e feriu-se na cabeça ; a dor chamou-o não à razão , mas ao refletido ressentimento do seu desencanto ; sentou-se e apoiou a fronte sobre os joelhos , e nem percebeu o sangue que lhe corria da cabeça ferida .	7	escravo	escravo
594	no coração do escravo , é fazê-lo	Dar por prazo da liberdade a morte de alguém é excitar um apetite de hiena no coração do escravo , é fazê-lo aspirar à morte de quem enquanto vivo lhe demora a alforria .	7	escravo	escravo
595	pela condição de escravo , sem educação	Simeão , o crioulo mimoso , perdido , malcriado pelas afetuosas condescendências e fraquezas dos senhores em casa , pervertido pelos deboches da venda e pelo veneno da crápula , ingrato pela condição de escravo , sem educação e sem hábito de trabalho , contando com a liberdade , e não a conseguindo , era um perverso armado loucamente contra seus senhores pelas mãos de seus senhores .	7	escravo	escravo
598	coração do pequeno escravo predileto as noções	Ao senhor que se afeiçoa do crioulo que vê nascer e cria com amor , cumpre completar o favor dos sentimentos com o favor da educação , inoculando no coração do pequeno escravo predileto as noções do dever , o ensino da religião , a virtude da paciência , a obrigação do trabalho que moraliza e nobilita o homem , do trabalho não do homem máquina , mas do homem inteligência e coração .	7	escravo	escravo
599	porque enfim é escravo , e portanto	O escravo assim criado pode não ser um amigo , porque enfim é escravo , e portanto um oprimido pela prepotência do senhor ainda mesmo bom ; é , porém , em regra , um homem agradecido , que esquece o forçado aviltamento da sua condição pela lembrança inteligente dos benefícios recebidos .	7	escravo	escravo
600	não educa o escravo simpático ou preferido	Mas o amor cego que não educa o escravo simpático ou preferido , que o abandona aos instintos , aos sentimentos baixos , às inspirações malévolas da escravidão , que é água encharcada e foco de miasmas , que o aquece ou o cria por traiçoeira , mal pensada compaixão na ociosidade , que é a placenta de todos os vícios , alimenta , aquece , fortifica um desgraçado que é sempre ingrato por ser escravo , e às vezes inimigo pela reação do oprimido .	7	escravo	escravo
600	ingrato por ser escravo , e às	Mas o amor cego que não educa o escravo simpático ou preferido , que o abandona aos instintos , aos sentimentos baixos , às inspirações malévolas da escravidão , que é água encharcada e foco de miasmas , que o aquece ou o cria por traiçoeira , mal pensada compaixão na ociosidade , que é a placenta de todos os vícios , alimenta , aquece , fortifica um desgraçado que é sempre ingrato por ser escravo , e às vezes inimigo pela reação do oprimido .	7	escravo	escravo
603	cadáver : o escravo crioulo , antes	O escravo africano mata o senhor , e se afasta do cadáver : o escravo crioulo , antes de matar , atormenta e ri das agonias do senhor , e depois de matar insulta e esquarteja o cadáver .	7	escravo	escravo
608	do que o escravo : sua condição	Ninguém dissimula melhor do que o escravo : sua condição sempre passiva , a obrigação da obediência sem limite e sem reflexão , o temor do castigo , a necessidade de esconder o ressentimento para não excitar a cólera ameaçadora do senhor , o hábito da mentira , enfim , fazem do escravo o tipo da dissimulação .	7	escravo	escravo
